{"artifact_type":"PlanetaryScaleEvidenceCertificate","artifact_version":"1.0.0","asset_execution_enabled":false,"asset_recovery_executor":"DISARMED","autonomous_protocol_merge":false,"candidate_incremental_full_replay_equal":true,"candidate_root":"sha256:d0f6994513bd4ecb621be9d69ff0dc44ef36b1f9f84af3092e415f3545904a8a","certificate_root":"sha256:87d0dcf25b10cb6bf9213b530ac8a21b50d0d7b7ac6c09b0c98592e9c530e7bd","certificate_status":"SCALE_ENVELOPE_REPRODUCED","claim_label":"[SIM]","evidence_class":"SIMULATED","frozen_protocol_heads":{"ahin":"1dc061616ab16c48cfef1b165f925a2fda99db1c","cai":"6048008a0e34897b172a9c3171d34ac12c692ada","chainrank":"c2cf581c786eb35fc2f9ec789838db9a98e1829b","claim_label":"[M]","pocc":"8902b22c04511ac60d81f9f6e6d24d48350aa4d9"},"full_replay_root":"sha256:d0f6994513bd4ecb621be9d69ff0dc44ef36b1f9f84af3092e415f3545904a8a","gates":[{"claim_label":"[D]","evidence":{"deterministic_candidate_root_equal":true,"topology_root_equal":true},"gate":"S0","status":"PASS"},{"claim_label":"[SIM]","evidence":{"measured":98304,"threshold":98304},"gate":"S1","status":"PASS_SIMULATED"},{"claim_label":"[SIM]","evidence":{"active_concurrency":4096,"sustained_throughput_events_per_second":768},"gate":"S2","status":"PASS_SIMULATED"},{"claim_label":"[SIM]","evidence":{"cross_cell_commitments_per_second":48,"global_roots_per_second":1},"gate":"S3","status":"PASS_SIMULATED"},{"claim_label":"[SIM]","evidence":{"all_faults_recovered":true,"candidate_incremental_full_replay_equal":true,"fault_count":9},"gate":"S4","status":"PASS_SIMULATED"},{"claim_label":"[EXP]","evidence":{"emulated_region_provider_architecture_thresholds_pass":true,"independent_build_platforms":2,"required_independent_build_platforms":2},"gate":"S5","status":"PASS_REPRODUCED"}],"incremental_root":"sha256:d0f6994513bd4ecb621be9d69ff0dc44ef36b1f9f84af3092e415f3545904a8a","independent_build_platforms":2,"planetary_live_scale_proved":false,"planetary_scale_envelope_proved":true,"profile_root":"sha256:e79903553739b9c1f16dbebaef0c5e428f4c89f1973e1572070ed1685b95e8e3","protocol_finality_proved":false,"required_independent_build_platforms":2,"run_root":"sha256:d9ca42856e61289d9104066450dcb08897a1f7afa18fa1edb0b5d1654759b724","s0_through_s4_complete":true,"s5_independent_reproduction_complete":true,"simulated_topology_only":true,"topology_root":"sha256:65b43242ed2814768ae2a979f51aea8c560c410c4c88649d7721a92e906f1723","transaction_submission":false}
